"jurisdiction","regulation_or_guidance","source_url","risk_domain","requirement_summary","applies_to_vocaliq","applicability_rationale","product_requirement","technical_control","operational_control","evidence_required","owner","priority","implementation_phase","legal_review_required","last_verified_date"
"Multi-jurisdiction","Recordkeeping requirements (MAS, FCA, US federal banking regulators)","Multiple sources per jurisdiction","Recordkeeping and audit","Financial services firms must maintain records of customer interactions, decisions, and transactions. Records must be complete, accurate, and retrievable. Retention periods vary by jurisdiction and record type (typically 5-7 years for customer interactions).","Yes","Every VocalIQ call produces records (audio, transcript, graph state, model decisions, tool calls, policy decisions). These must be complete, tamper-evident, and retained per jurisdiction requirements.","Complete audit record for every call. Tamper-evident storage. Configurable retention periods. Retrievability for regulatory requests. Export capability for bank compliance.","Audit Ledger capturing: call metadata, authentication events, policy decisions, tool calls and responses, data disclosed, actions taken, human interventions, call outcome. Tamper-evident storage (append-only, cryptographic hashing). Configurable retention. Search and retrieval API.","Retention policy management. Regular audit completeness checks. Regulatory request response procedures. Archive management.","Audit completeness reports. Retention policy documentation. Sample audit records. Tamper-evidence verification.","CTO","P0","MVP","Yes","2026-05-03"
"Multi-jurisdiction","Accessibility requirements (ADA in US, Equality Act 2010 in UK, EU Accessibility Act)","Multiple sources per jurisdiction","Accessibility and language support","Financial services must be accessible to people with disabilities. Voice AI must accommodate hearing impairment (alternative channels), speech impairment (patience, clarification, alternative input), cognitive impairment (simpler language, confirmation checks), and language barriers (multilingual support or interpreter routing).","Yes","VocalIQ's voice channel must accommodate callers with various accessibility needs. Failure to do so exposes banks to discrimination claims.","Fallback to human agent for callers who cannot interact with AI. Patience parameters for speech-impaired callers. Simpler language mode. Interpreter routing. Text-based alternative channel support.","Configurable speech recognition sensitivity and timeout. Adaptive pace and language complexity. Interpreter queue routing. TTY/relay service compatibility. Alternative channel handoff.","Accessibility testing with diverse caller profiles. Regular accessibility audit. Accommodation procedure documentation.","Accessibility testing results. Accommodation procedure documentation. Accessibility audit reports.","Chief Product Officer","P2","Phase 2","Yes","2026-05-03"
"Multi-jurisdiction","OWASP Top 10 for LLM Applications 2025","https://owasp.org/www-project-top-10-for-large-language-model-applications/","Cybersecurity","Top 10 LLM security risks: prompt injection, sensitive information disclosure, supply chain vulnerabilities, data/model poisoning, improper output handling, excessive agency, system prompt leakage, vector/embedding weaknesses, misinformation, unbounded consumption.","Yes","VocalIQ uses LLMs in the conversation runtime. All OWASP LLM Top 10 risks are directly applicable.","Prompt injection defense (caller speech is untrusted input). Sensitive information disclosure prevention. Supply chain security for model providers. Output validation. Agency controls (least privilege). System prompt protection. Hallucination/misinformation controls.","Input sanitization in conversation runtime. Output validation before TTS. Model Gateway with provider abstraction and fallback. Tool Gateway with least-privilege scoping. System prompt isolation. RAG with approved-content-only sources. Rate limiting and resource controls.","Regular adversarial testing (prompt injection, jailbreak). Model provider security assessment. Vulnerability scanning. Incident response for LLM-specific attacks.","Adversarial test results. Prompt injection defense documentation. Vulnerability scan reports. Model provider security assessments.","CISO","P0","MVP","No","2026-05-03"
"US","FCC TCPA (AI-Generated Voice Ruling)","https://www.fcc.gov/document/fcc-confirms-tcpa-applies-ai-technologies-generate-human-voices","Electronic marketing and outbound calls","TCPA applies to AI-generated voice calls. Prior express consent required. DNC list compliance. Calling window restrictions. Opt-out mechanisms.","Yes (future outbound features)","VocalIQ's MVP is inbound-only per handoff guidance. However, outbound features (safe callback for fraud alerts, appointment reminders) must comply with TCPA when implemented.","Consent verification before any outbound AI voice call. DNC list integration. Calling window enforcement. Opt-out mechanism. Safe callback protocol for fraud alerts (bank-initiated to registered number).","Consent verification gate before outbound calls. DNC list check. Calling window enforcement per timezone. Opt-out recording and enforcement. Safe callback using registered number only.","Consent record maintenance. DNC list updates. Calling window monitoring. Opt-out processing.","Consent records. DNC compliance documentation. Calling window compliance logs. Opt-out processing records.","Compliance Officer","P2","Phase 2","Yes","2026-05-03"
"US","ECOA / Regulation B (Equal Credit Opportunity Act)","https://www.consumerfinance.gov/rules-policy/regulations/1002/","Consumer protection and conduct risk","Prohibits discrimination in credit transactions. Adverse action notices must explain specific reasons for denial. CFPB has issued guidance that algorithmic explanations must be specific and accurate, not generic.","Yes (prohibition enforcement)","VocalIQ must never make credit decisions (A6 prohibited). This regulation reinforces the prohibition and ensures the AI does not inadvertently provide credit-related guidance that could be construed as a decision.","Credit decision prohibition enforced at graph compiler, policy engine, and tool gateway levels. AI must not explain credit decisions. AI must not assess creditworthiness. Transfer to human for all credit-related inquiries.","Graph compiler rejects credit decision nodes. Policy engine blocks credit-related API calls. Content boundary prevents creditworthiness statements. Advice boundary detection for credit-adjacent topics.","Regular testing of credit decision prohibition. Content review for credit-related topics in knowledge base. Staff training on credit decision boundaries.","Prohibition enforcement logs. Adversarial test results for credit decision bypass. Content review documentation.","Compliance Officer","P0","MVP","Yes","2026-05-03"
"Singapore","PDPC Do Not Call Registry / Spam Control Act","https://www.pdpc.gov.sg/overview-of-pdpa/the-legislation/do-not-call-provisions","Electronic marketing and outbound calls","Singapore Do Not Call Registry prohibits sending marketing messages (including voice calls) to numbers on the DNC register without clear and unambiguous consent. The Spam Control Act regulates unsolicited commercial communications. Penalties for violations.","Yes (future outbound features)","VocalIQ MVP is inbound-only. Any future outbound calling (appointment reminders, fraud callbacks, marketing) must comply with PDPC DNC provisions. Singapore is the primary launch market.","DNC registry check before outbound calls. Consent verification and management. Opt-out mechanism. Calling identification display requirements.","DNC list integration. Consent verification gate. Caller ID display. Opt-out recording and enforcement.","DNC registry subscription and updates. Consent record maintenance. Opt-out processing. Compliance monitoring.","DNC compliance documentation. Consent records. Opt-out processing records.","Compliance Officer","P2","Phase 2","Yes","2026-05-03"
"EU","ePrivacy Directive (2002/58/EC) / upcoming ePrivacy Regulation","https://eur-lex.europa.eu/legal-content/EN/ALL/?uri=CELEX%3A32002L0058","Electronic marketing and outbound calls","The ePrivacy Directive requires prior consent for electronic marketing communications including automated calling systems. Member states implement nationally with variations. Upcoming ePrivacy Regulation may unify requirements. Automated calls using AI-generated voice require prior express consent.","Yes (future outbound features)","Any outbound AI voice calling in the EU must comply with ePrivacy Directive and national implementations. EU member state variations add complexity.","Prior express consent for outbound automated calls. National opt-out list compliance. Caller identification. Opt-out mechanism in every call. Calling window restrictions per member state.","Consent verification gate. National DNC/opt-out list integration. Caller ID management. Calling window enforcement per jurisdiction. Consent withdrawal processing.","National DNC list subscriptions. Consent management across member states. Compliance monitoring per member state. Regulatory change tracking for ePrivacy Regulation.","Consent records per member state. DNC compliance documentation. Calling window compliance logs.","Compliance Officer","P2","Phase 2","Yes","2026-05-03"
"UK","PECR (Privacy and Electronic Communications Regulations 2003)","https://ico.org.uk/for-organisations/direct-marketing-and-privacy-and-electronic-communications/guide-to-pecr/","Electronic marketing and outbound calls","PECR regulates electronic marketing including automated calling systems. Automated calls (which AI voice calls would qualify as) require prior express consent. The Telephone Preference Service (TPS) must be checked before live marketing calls. ICO enforces with monetary penalties up to GBP 500,000.","Yes (future outbound features)","Any outbound AI voice calling in the UK must comply with PECR. AI-generated voice calls are classified as automated calls requiring prior consent.","Prior express consent for outbound automated calls. TPS register check. Caller identification. Opt-out mechanism. Calling window compliance.","Consent verification gate. TPS list integration. Caller ID display. Opt-out recording and enforcement. Calling window enforcement.","TPS subscription and updates. Consent record maintenance. ICO registration. Compliance monitoring.","Consent records. TPS compliance documentation. ICO registration. Opt-out processing records.","Compliance Officer","P2","Phase 2","Yes","2026-05-03"
